Планирую отпуск с уклоном в история и обязательно с походы.,история;походы;шопинг
"Просто хочу поездку с пляж, а остальное — как получится.",пляж;походы
"Просто хочу поездку с еда, а остальное — как получится.",еда;культура;пляж
"Хочу поездку, чтобы отдохнуть и посмотреть на искусство, может быть, ещё парк.",искусство;парк
"Тур по Европе, главное — дегустации, но и природа не помешает.",дегустации;природа
"Маршрут, включающий еда, музыка, ночная жизнь — реально?",еда;музыка;ночная жизнь
"Интересуют активность, винный туризм, ну и конечно животные.",активность;винный туризм;животные
"Тур по Европе, главное — пляж, но и шопинг не помешает.",пляж;шопинг
"Мне нужно всё сразу: и архитектура, и дегустации, и животные.",архитектура;дегустации;животные
"Маршрут, включающий активность, пляж,  — реально?",активность;пляж
Ищу место для фото с винный туризм и прогулками в культура.,винный туризм;культура;парк
"Ищу необычный маршрут: хочется и искусство, и немного история.",искусство;история
"Интересует маршрут с культура и , но без спешки.",культура
"Подскажите город с искусство, походы, и чтобы вкусно поесть.",искусство;походы;фотография
"Ищу необычный маршрут: хочется и винный туризм, и немного пляж.",винный туризм;пляж
"Интересует маршрут с животные и музыка, но без спешки.",животные;музыка;шопинг
"Хочу поездку, чтобы отдохнуть и посмотреть на архитектура, может быть, ещё искусство.",архитектура;искусство;релакс
"Хочу отдых, где можно совместить музыка, парк и хорошее настроение.",музыка;парк
"Подскажите город с история, , и чтобы вкусно поесть.",история
"Меня интересуют дегустации,  и что-то связанное с .",дегустации
"Куда поехать летом, чтобы были ночная жизнь, походы и даже немного ?",ночная жизнь;походы
"Планирую тур с еда, вкусной спорт и атмосферой .",еда;спорт
"Хочу в путешествии увидеть животные, попробовать природа, а может и .",животные;природа
"Интересуют шопинг, , ну и конечно .",шопинг
"Хочу поездку, чтобы отдохнуть и посмотреть на архитектура, может быть, ещё животные.",архитектура;животные
Ищу место для фото с архитектура и прогулками в музыка.,архитектура;музыка
"Маршрут, включающий история, походы,  — реально?",история;походы
"Просто хочу поездку с еда, а остальное — как получится.",еда;релакс
"Мне нужно всё сразу: и дегустации, и искусство, и .",дегустации;искусство
Что порекомендуете для любителя винный туризм и парк?,винный туризм;парк
Где можно насладиться активность и заодно заняться еда?,активность;еда
Что порекомендуете для любителя животные и фотография?,животные;фотография
"Куда поехать летом, чтобы были пляж, шопинг и даже немного ?",пляж;шопинг
Ищу место для фото с еда и прогулками в фотография.,еда;фотография
"Посоветуйте место, где есть активность, а вечером — парк.",активность;парк;пляж
"Мне нужно всё сразу: и парк, и религия, и .",парк;религия
"Просто хочу поездку с культура, а остальное — как получится.",культура
"Интересует маршрут с искусство и парк, но без спешки.",искусство;парк;походы
Где в Европе можно насладиться еда и посетить походы?,еда;походы
"Просто хочу поездку с винный туризм, а остальное — как получится.",винный туризм;релакс
"Хочу в путешествии увидеть животные, попробовать искусство, а может и .",животные;искусство
"Интересует маршрут с ночная жизнь и религия, но без спешки.",ночная жизнь;религия
"Меня интересуют активность, ночная жизнь и что-то связанное с походы.",активность;ночная жизнь;походы
"Ищу необычный маршрут: хочется и парк, и немного .",парк
Планирую отпуск с уклоном в активность и обязательно с спорт.,активность;спорт
"Маршрут, включающий парк, шопинг,  — реально?",парк;шопинг
Ищу место для фото с архитектура и прогулками в еда.,архитектура;еда;природа
Что порекомендуете для любителя активность и музыка?,активность;музыка
"Куда поехать летом, чтобы были культура, религия и даже немного ?",культура;религия
"Хочу отдых, где можно совместить еда, релакс и хорошее настроение.",еда;релакс;фотография
"Планирую тур с активность, вкусной религия и атмосферой .",активность;религия
"Ищу необычный маршрут: хочется и культура, и немного .",культура
"Тур по Европе, главное — винный туризм, но и природа не помешает.",винный туризм;природа
"Хочу поездку, чтобы отдохнуть и посмотреть на архитектура, может быть, ещё винный туризм.",архитектура;винный туризм;животные
"Интересуют дегустации, искусство, ну и конечно .",дегустации;искусство
"Просто хочу поездку с музыка, а остальное — как получится.",музыка
"Мне нужно всё сразу: и религия, и , и .",религия
Ищу место для фото с музей и прогулками в спорт.,музей;спорт
"Маршрут, включающий еда, искусство, религия — реально?",еда;искусство;религия
"Подскажите город с активность, релакс, и чтобы вкусно поесть.",активность;релакс
"Маршрут, включающий ночная жизнь, парк,  — реально?",ночная жизнь;парк
"Подскажите город с парк, пляж, и чтобы вкусно поесть.",парк;пляж
"Хочу поездку, чтобы отдохнуть и посмотреть на винный туризм, может быть, ещё музей.",винный туризм;музей;походы
"Интересуют винный туризм, парк, ну и конечно шопинг.",винный туризм;парк;шопинг
Планирую отпуск с уклоном в животные и обязательно с музей.,животные;музей
"Ищу необычный маршрут: хочется и культура, и немного походы.",культура;походы
"Куда поехать летом, чтобы были архитектура, еда и даже немного ?",архитектура;еда
"Куда поехать летом, чтобы были религия, спорт и даже немного ?",религия;спорт
"Мне нужно всё сразу: и дегустации, и музыка, и .",дегустации;музыка
"Планирую тур с животные, вкусной походы и атмосферой шопинг.",животные;походы;шопинг
"Тур по Европе, главное — архитектура, но и парк не помешает.",архитектура;парк;релакс
Ищу место для фото с дегустации и прогулками в еда.,дегустации;еда
"Хочу в путешествии увидеть дегустации, попробовать пляж, а может и .",дегустации;пляж
"Хочу отдых, где можно совместить ночная жизнь, религия и хорошее настроение.",ночная жизнь;религия
"Мне нужно всё сразу: и винный туризм, и музыка, и религия.",винный туризм;музыка;религия
"Мне нужно всё сразу: и спорт, и фотография, и .",спорт;фотография
"Ищу необычный маршрут: хочется и искусство, и немного шопинг.",искусство;шопинг
Планирую отпуск с уклоном в парк и обязательно с религия.,парк;религия;спорт
"Подскажите город с архитектура, ночная жизнь, и чтобы вкусно поесть.",архитектура;ночная жизнь;фотография
"Интересует маршрут с ночная жизнь и природа, но без спешки.",ночная жизнь;природа
"Интересует маршрут с активность и дегустации, но без спешки.",активность;дегустации;парк
"Посоветуйте место, где есть винный туризм, а вечером — животные.",винный туризм;животные;ночная жизнь
"Меня интересуют пляж,  и что-то связанное с .",пляж
"Просто хочу поездку с дегустации, а остальное — как получится.",дегустации;походы;спорт
"Тур по Европе, главное — активность, но и музыка не помешает.",активность;музыка
"Посоветуйте место, где есть дегустации, а вечером — еда.",дегустации;еда;животные
"Маршрут, включающий музей, ночная жизнь,  — реально?",музей;ночная жизнь
"Тур по Европе, главное — культура, но и музыка не помешает.",культура;музыка
"Куда поехать летом, чтобы были активность, ночная жизнь и даже немного парк?",активность;ночная жизнь;парк
Где можно насладиться ночная жизнь и заодно заняться спорт?,ночная жизнь;спорт
"Подскажите город с еда, культура, и чтобы вкусно поесть.",еда;культура
Ищу место для фото с фотография и прогулками в .,фотография
Что порекомендуете для любителя винный туризм и еда?,винный туризм;еда;шопинг
"Интересует маршрут с культура и музыка, но без спешки.",культура;музыка
"Хочу поездку, чтобы отдохнуть и посмотреть на искусство, может быть, ещё пляж.",искусство;пляж;релакс
"Интересуют искусство, ночная жизнь, ну и конечно .",искусство;ночная жизнь
"Хочу отдых, где можно совместить архитектура, еда и хорошее настроение.",архитектура;еда
"Куда поехать летом, чтобы были активность, архитектура и даже немного ?",активность;архитектура
"Мне нужно всё сразу: и ночная жизнь, и походы, и .",ночная жизнь;походы
"Хочу в путешествии увидеть походы, попробовать фотография, а может и .",походы;фотография
"Планирую тур с история, вкусной релакс и атмосферой .",история;релакс
Где можно насладиться винный туризм и заодно заняться музыка?,винный туризм;музыка;пляж
"Интересуют архитектура, еда, ну и конечно парк.",архитектура;еда;парк
"Ищу необычный маршрут: хочется и винный туризм, и немного еда.",винный туризм;еда
"Мне нужно всё сразу: и природа, и шопинг, и .",природа;шопинг
Где можно насладиться винный туризм и заодно заняться походы?,винный туризм;походы;спорт
"Интересует маршрут с музей и фотография, но без спешки.",музей;фотография
"Интересует маршрут с культура и релакс, но без спешки.",культура;релакс
"Куда поехать летом, чтобы были винный туризм, история и даже немного парк?",винный туризм;история;парк
"Маршрут, включающий походы, природа, спорт — реально?",походы;природа;спорт
"Хочу поездку, чтобы отдохнуть и посмотреть на ночная жизнь, может быть, ещё релакс.",ночная жизнь;релакс
"Хочу в путешествии увидеть винный туризм, попробовать ночная жизнь, а может и .",винный туризм;ночная жизнь
"Подскажите город с история, культура, и чтобы вкусно поесть.",история;культура
"Хочу отдых, где можно совместить религия, фотография и хорошее настроение.",религия;фотография
"Интересует маршрут с фотография и , но без спешки.",фотография
Планирую отпуск с уклоном в искусство и обязательно с музей.,искусство;музей;природа
"Тур по Европе, главное — шопинг, но и  не помешает.",шопинг
"Планирую тур с еда, вкусной религия и атмосферой .",еда;религия
"Мне нужно всё сразу: и музей, и шопинг, и .",музей;шопинг
"Хочу поездку, чтобы отдохнуть и посмотреть на дегустации, может быть, ещё .",дегустации
"Тур по Европе, главное — активность, но и дегустации не помешает.",активность;дегустации;музей
"Интересуют винный туризм, музей, ну и конечно музыка.",винный туризм;музей;музыка
"Интересуют пляж, религия, ну и конечно .",пляж;религия
"Интересуют культура, релакс, ну и конечно .",культура;релакс
"Планирую тур с животные, вкусной походы и атмосферой релакс.",животные;походы;релакс
"Хочу поездку, чтобы отдохнуть и посмотреть на винный туризм, может быть, ещё искусство.",винный туризм;искусство;культура
"Планирую тур с активность, вкусной еда и атмосферой искусство.",активность;еда;искусство
"Интересуют история, фотография, ну и конечно .",история;фотография
"Куда поехать летом, чтобы были активность, животные и даже немного ?",активность;животные
"Куда поехать летом, чтобы были парк, спорт и даже немного ?",парк;спорт
"Просто хочу поездку с животные, а остальное — как получится.",животные;шопинг
Планирую отпуск с уклоном в архитектура и обязательно с .,архитектура
"Хочу в путешествии увидеть животные, попробовать музей, а может и .",животные;музей
"Тур по Европе, главное — винный туризм, но и фотография не помешает.",винный туризм;фотография
"Меня интересуют культура, походы и что-то связанное с релакс.",культура;походы;релакс
Планирую отпуск с уклоном в дегустации и обязательно с пляж.,дегустации;пляж
"Хочу отдых, где можно совместить религия,  и хорошее настроение.",религия
"Просто хочу поездку с архитектура, а остальное — как получится.",архитектура;история
Что порекомендуете для любителя культура и музыка?,культура;музыка;шопинг
Где в Европе можно насладиться ночная жизнь и посетить походы?,ночная жизнь;походы
"Интересуют походы, , ну и конечно .",походы
"Интересует маршрут с религия и , но без спешки.",религия
Ищу место для фото с архитектура и прогулками в релакс.,архитектура;релакс
"Просто хочу поездку с архитектура, а остальное — как получится.",архитектура;походы;фотография
"Планирую тур с архитектура, вкусной музей и атмосферой .",архитектура;музей
"Ищу необычный маршрут: хочется и история, и немного шопинг.",история;шопинг
Что порекомендуете для любителя музыка и ?,музыка
"Посоветуйте место, где есть архитектура, а вечером — культура.",архитектура;культура;музей
"Ищу необычный маршрут: хочется и фотография, и немного шопинг.",фотография;шопинг
"Ищу необычный маршрут: хочется и дегустации, и немного .",дегустации
Где в Европе можно насладиться музыка и посетить религия?,музыка;религия;шопинг
"Посоветуйте место, где есть природа, а вечером — шопинг.",природа;шопинг
"Ищу необычный маршрут: хочется и история, и немного .",история
Где в Европе можно насладиться история и посетить ?,история
"Интересует маршрут с винный туризм и животные, но без спешки.",винный туризм;животные
Что порекомендуете для любителя музыка и парк?,музыка;парк;природа
"Подскажите город с еда, ночная жизнь, и чтобы вкусно поесть.",еда;ночная жизнь;парк
"Интересуют дегустации, ночная жизнь, ну и конечно .",дегустации;ночная жизнь
Что порекомендуете для любителя природа и ?,природа
Что порекомендуете для любителя архитектура и еда?,архитектура;еда
"Интересуют еда, животные, ну и конечно .",еда;животные
"Хочу отдых, где можно совместить активность, релакс и хорошее настроение.",активность;релакс
"Ищу необычный маршрут: хочется и архитектура, и немного пляж.",архитектура;пляж
"Тур по Европе, главное — животные, но и походы не помешает.",животные;походы
Что порекомендуете для любителя ночная жизнь и релакс?,ночная жизнь;релакс
"Маршрут, включающий история, спорт,  — реально?",история;спорт
"Подскажите город с ночная жизнь, походы, и чтобы вкусно поесть.",ночная жизнь;походы
"Куда поехать летом, чтобы были походы,  и даже немного ?",походы
Где в Европе можно насладиться культура и посетить фотография?,культура;фотография
Ищу место для фото с походы и прогулками в .,походы
"Интересует маршрут с животные и искусство, но без спешки.",животные;искусство
"Планирую тур с пляж, вкусной природа и атмосферой спорт.",пляж;природа;спорт
"Куда поехать летом, чтобы были дегустации, шопинг и даже немного ?",дегустации;шопинг
"Посоветуйте место, где есть история, а вечером — культура.",история;культура
"Интересуют активность, животные, ну и конечно .",активность;животные
"Планирую тур с архитектура, вкусной винный туризм и атмосферой искусство.",архитектура;винный туризм;искусство
Ищу место для фото с искусство и прогулками в музыка.,искусство;музыка;религия
"Меня интересуют винный туризм, религия и что-то связанное с .",винный туризм;религия
Планирую отпуск с уклоном в активность и обязательно с .,активность
"Маршрут, включающий пляж, природа,  — реально?",пляж;природа
"Куда поехать летом, чтобы были искусство, музыка и даже немного ?",искусство;музыка
"Интересует маршрут с история и культура, но без спешки.",история;культура;религия
"Мне нужно всё сразу: и архитектура, и спорт, и .",архитектура;спорт
