"Маршрут, включающий винный туризм, еда, музыка — реально?",винный туризм;еда;музыка
"Подскажите город с винный туризм, музыка, и чтобы вкусно поесть.",винный туризм;музыка
"Хочу поездку, чтобы отдохнуть и посмотреть на архитектура, может быть, ещё природа.",архитектура;природа;спорт
Ищу место для фото с дегустации и прогулками в еда.,дегустации;еда;фотография
"Подскажите город с винный туризм, культура, и чтобы вкусно поесть.",винный туризм;культура;ночная жизнь
"Маршрут, включающий фотография, ,  — реально?",фотография
"Интересует маршрут с искусство и ночная жизнь, но без спешки.",искусство;ночная жизнь
"Интересует маршрут с парк и религия, но без спешки.",парк;религия
"Мне нужно всё сразу: и винный туризм, и культура, и музей.",винный туризм;культура;музей
"Посоветуйте место, где есть архитектура, а вечером — дегустации.",архитектура;дегустации;история
Где можно насладиться религия и заодно заняться спорт?,религия;спорт;фотография
"Хочу в путешествии увидеть искусство, попробовать спорт, а может и .",искусство;спорт
Где можно насладиться активность и заодно заняться история?,активность;история
Где можно насладиться музей и заодно заняться религия?,музей;религия;шопинг
Планирую отпуск с уклоном в дегустации и обязательно с религия.,дегустации;религия;фотография
"Просто хочу поездку с искусство, а остальное — как получится.",искусство
"Ищу необычный маршрут: хочется и музыка, и немного пляж.",музыка;пляж;походы
Что порекомендуете для любителя история и музыка?,история;музыка
"Интересуют искусство, музыка, ну и конечно походы.",искусство;музыка;походы
"Интересует маршрут с искусство и история, но без спешки.",искусство;история
Где можно насладиться история и заодно заняться религия?,история;религия
"Планирую тур с искусство, вкусной музыка и атмосферой шопинг.",искусство;музыка;шопинг
"Тур по Европе, главное — дегустации, но и музыка не помешает.",дегустации;музыка
"Планирую тур с ночная жизнь, вкусной природа и атмосферой религия.",ночная жизнь;природа;религия
"Хочу в путешествии увидеть пляж, попробовать , а может и .",пляж
Ищу место для фото с музей и прогулками в .,музей
Где можно насладиться активность и заодно заняться дегустации?,активность;дегустации
"Хочу отдых, где можно совместить животные, парк и хорошее настроение.",животные;парк
"Хочу отдых, где можно совместить культура, фотография и хорошее настроение.",культура;фотография
Где в Европе можно насладиться природа и посетить релакс?,природа;релакс;спорт
"Меня интересуют еда, культура и что-то связанное с ночная жизнь.",еда;культура;ночная жизнь
Планирую отпуск с уклоном в культура и обязательно с спорт.,культура;спорт
"Мне нужно всё сразу: и история, и музыка, и .",история;музыка
"Посоветуйте место, где есть релакс, а вечером — шопинг.",релакс;шопинг
Где можно насладиться ночная жизнь и заодно заняться природа?,ночная жизнь;природа;фотография
"Маршрут, включающий релакс, ,  — реально?",релакс
Где можно насладиться история и заодно заняться ночная жизнь?,история;ночная жизнь
Планирую отпуск с уклоном в искусство и обязательно с пляж.,искусство;пляж;спорт
"Интересуют культура, фотография, ну и конечно .",культура;фотография
"Хочу поездку, чтобы отдохнуть и посмотреть на парк, может быть, ещё .",парк
"Посоветуйте место, где есть природа, а вечером — .",природа
"Ищу необычный маршрут: хочется и дегустации, и немного религия.",дегустации;религия
Где в Европе можно насладиться ночная жизнь и посетить релакс?,ночная жизнь;релакс
"Посоветуйте место, где есть музей, а вечером — фотография.",музей;фотография
"Хочу отдых, где можно совместить активность, культура и хорошее настроение.",активность;культура
"Хочу поездку, чтобы отдохнуть и посмотреть на архитектура, может быть, ещё релакс.",архитектура;релакс
"Хочу поездку, чтобы отдохнуть и посмотреть на походы, может быть, ещё .",походы
"Куда поехать летом, чтобы были дегустации, история и даже немного ?",дегустации;история
"Куда поехать летом, чтобы были активность, животные и даже немного музей?",активность;животные;музей
Где можно насладиться активность и заодно заняться ?,активность
"Планирую тур с активность, вкусной ночная жизнь и атмосферой спорт.",активность;ночная жизнь;спорт
"Ищу необычный маршрут: хочется и активность, и немного походы.",активность;походы
"Подскажите город с религия, спорт, и чтобы вкусно поесть.",религия;спорт
"Планирую тур с музей, вкусной релакс и атмосферой шопинг.",музей;релакс;шопинг
"Интересуют архитектура, парк, ну и конечно шопинг.",архитектура;парк;шопинг
"Подскажите город с активность, дегустации, и чтобы вкусно поесть.",активность;дегустации;культура
"Посоветуйте место, где есть активность, а вечером — архитектура.",активность;архитектура;музей
"Хочу поездку, чтобы отдохнуть и посмотреть на активность, может быть, ещё искусство.",активность;искусство;пляж
Где можно насладиться винный туризм и заодно заняться религия?,винный туризм;религия
"Просто хочу поездку с животные, а остальное — как получится.",животные;культура
"Хочу отдых, где можно совместить ночная жизнь, шопинг и хорошее настроение.",ночная жизнь;шопинг
"Просто хочу поездку с еда, а остальное — как получится.",еда;музыка;походы
"Посоветуйте место, где есть винный туризм, а вечером — еда.",винный туризм;еда
"Планирую тур с шопинг, вкусной  и атмосферой .",шопинг
"Маршрут, включающий история, музыка,  — реально?",история;музыка
Где в Европе можно насладиться фотография и посетить ?,фотография
Где в Европе можно насладиться животные и посетить парк?,животные;парк;религия
Что порекомендуете для любителя музыка и парк?,музыка;парк;шопинг
"Куда поехать летом, чтобы были еда, религия и даже немного шопинг?",еда;религия;шопинг
"Планирую тур с музыка, вкусной ночная жизнь и атмосферой религия.",музыка;ночная жизнь;религия
"Интересуют музыка, религия, ну и конечно .",музыка;религия
"Подскажите город с пляж, фотография, и чтобы вкусно поесть.",пляж;фотография
"Хочу поездку, чтобы отдохнуть и посмотреть на история, может быть, ещё ночная жизнь.",история;ночная жизнь
Планирую отпуск с уклоном в походы и обязательно с .,походы
"Меня интересуют культура, музыка и что-то связанное с релакс.",культура;музыка;релакс
"Подскажите город с парк, фотография, и чтобы вкусно поесть.",парк;фотография
"Тур по Европе, главное — животные, но и релакс не помешает.",животные;релакс
"Мне нужно всё сразу: и дегустации, и ночная жизнь, и .",дегустации;ночная жизнь
"Меня интересуют животные, пляж и что-то связанное с .",животные;пляж
"Посоветуйте место, где есть дегустации, а вечером — музей.",дегустации;музей
"Мне нужно всё сразу: и культура, и религия, и .",культура;религия
"Тур по Европе, главное — искусство, но и пляж не помешает.",искусство;пляж;фотография
"Меня интересуют еда, музей и что-то связанное с .",еда;музей
Где в Европе можно насладиться культура и посетить ?,культура
"Хочу в путешествии увидеть парк, попробовать , а может и .",парк
"Интересует маршрут с винный туризм и животные, но без спешки.",винный туризм;животные;искусство
"Интересуют фотография, , ну и конечно .",фотография
"Ищу необычный маршрут: хочется и еда, и немного религия.",еда;религия
"Планирую тур с животные, вкусной искусство и атмосферой ночная жизнь.",животные;искусство;ночная жизнь
"Подскажите город с история, походы, и чтобы вкусно поесть.",история;походы
"Ищу необычный маршрут: хочется и дегустации, и немного ночная жизнь.",дегустации;ночная жизнь
"Интересуют искусство, , ну и конечно .",искусство
"Интересуют активность, спорт, ну и конечно .",активность;спорт
"Меня интересуют музыка,  и что-то связанное с .",музыка
Где можно насладиться еда и заодно заняться религия?,еда;религия
"Посоветуйте место, где есть винный туризм, а вечером — история.",винный туризм;история;походы
"Посоветуйте место, где есть релакс, а вечером — спорт.",релакс;спорт
"Посоветуйте место, где есть архитектура, а вечером — искусство.",архитектура;искусство;фотография
"Планирую тур с еда, вкусной пляж и атмосферой религия.",еда;пляж;религия
"Хочу поездку, чтобы отдохнуть и посмотреть на винный туризм, может быть, ещё дегустации.",винный туризм;дегустации
"Меня интересуют архитектура,  и что-то связанное с .",архитектура
"Тур по Европе, главное — еда, но и религия не помешает.",еда;религия
"Подскажите город с релакс, , и чтобы вкусно поесть.",релакс
Где в Европе можно насладиться животные и посетить музей?,животные;музей
"Интересует маршрут с искусство и , но без спешки.",искусство
"Просто хочу поездку с активность, а остальное — как получится.",активность;релакс
"Хочу в путешествии увидеть музыка, попробовать ночная жизнь, а может и .",музыка;ночная жизнь
"Тур по Европе, главное — активность, но и винный туризм не помешает.",активность;винный туризм
"Меня интересуют винный туризм, шопинг и что-то связанное с .",винный туризм;шопинг
"Тур по Европе, главное — ночная жизнь, но и релакс не помешает.",ночная жизнь;релакс
"Интересует маршрут с релакс и , но без спешки.",релакс
"Посоветуйте место, где есть история, а вечером — природа.",история;природа
"Ищу необычный маршрут: хочется и история, и немного пляж.",история;пляж
"Тур по Европе, главное — ночная жизнь, но и пляж не помешает.",ночная жизнь;пляж
Планирую отпуск с уклоном в шопинг и обязательно с .,шопинг
Ищу место для фото с архитектура и прогулками в культура.,архитектура;культура;шопинг
"Хочу поездку, чтобы отдохнуть и посмотреть на архитектура, может быть, ещё еда.",архитектура;еда;история
"Интересуют активность, фотография, ну и конечно .",активность;фотография
Ищу место для фото с история и прогулками в природа.,история;природа
"Меня интересуют дегустации, пляж и что-то связанное с .",дегустации;пляж
"Интересует маршрут с культура и ночная жизнь, но без спешки.",культура;ночная жизнь;фотография
"Куда поехать летом, чтобы были история, релакс и даже немного ?",история;релакс
Где в Европе можно насладиться музей и посетить ?,музей
"Хочу отдых, где можно совместить архитектура, религия и хорошее настроение.",архитектура;религия
"Хочу в путешествии увидеть еда, попробовать , а может и .",еда
"Интересует маршрут с еда и культура, но без спешки.",еда;культура
"Посоветуйте место, где есть история, а вечером — походы.",история;походы
"Подскажите город с музей, спорт, и чтобы вкусно поесть.",музей;спорт
"Меня интересуют активность, музей и что-то связанное с спорт.",активность;музей;спорт
"Меня интересуют музей,  и что-то связанное с .",музей
"Меня интересуют дегустации, фотография и что-то связанное с .",дегустации;фотография
"Маршрут, включающий культура, ночная жизнь, религия — реально?",культура;ночная жизнь;религия
"Маршрут, включающий еда, музей,  — реально?",еда;музей
"Посоветуйте место, где есть еда, а вечером — походы.",еда;походы
"Подскажите город с архитектура, дегустации, и чтобы вкусно поесть.",архитектура;дегустации;религия
"Интересует маршрут с музей и релакс, но без спешки.",музей;релакс;религия
"Хочу поездку, чтобы отдохнуть и посмотреть на архитектура, может быть, ещё искусство.",архитектура;искусство
Где в Европе можно насладиться дегустации и посетить культура?,дегустации;культура;спорт
"Маршрут, включающий архитектура, природа,  — реально?",архитектура;природа
"Интересует маршрут с ночная жизнь и шопинг, но без спешки.",ночная жизнь;шопинг
"Маршрут, включающий история, музей,  — реально?",история;музей
"Интересуют винный туризм, спорт, ну и конечно .",винный туризм;спорт
Где в Европе можно насладиться дегустации и посетить ?,дегустации
"Планирую тур с музей, вкусной природа и атмосферой .",музей;природа
"Хочу в путешествии увидеть походы, попробовать природа, а может и .",походы;природа
"Хочу в путешествии увидеть винный туризм, попробовать искусство, а может и музыка.",винный туризм;искусство;музыка
"Планирую тур с активность, вкусной походы и атмосферой .",активность;походы
"Маршрут, включающий пляж, природа, религия — реально?",пляж;природа;религия
"Ищу необычный маршрут: хочется и винный туризм, и немного шопинг.",винный туризм;шопинг
"Маршрут, включающий активность, культура,  — реально?",активность;культура
Где можно насладиться архитектура и заодно заняться ?,архитектура
"Маршрут, включающий винный туризм, музей, парк — реально?",винный туризм;музей;парк
"Просто хочу поездку с активность, а остальное — как получится.",активность;искусство;фотография
Что порекомендуете для любителя архитектура и религия?,архитектура;религия;фотография
"Хочу отдых, где можно совместить искусство, культура и хорошее настроение.",искусство;культура;ночная жизнь
"Маршрут, включающий шопинг, ,  — реально?",шопинг
"Интересует маршрут с музыка и релакс, но без спешки.",музыка;релакс
Что порекомендуете для любителя дегустации и искусство?,дегустации;искусство;парк
Планирую отпуск с уклоном в искусство и обязательно с религия.,искусство;религия
"Тур по Европе, главное — дегустации, но и искусство не помешает.",дегустации;искусство;музей
"Куда поехать летом, чтобы были архитектура, дегустации и даже немного ?",архитектура;дегустации
"Меня интересуют животные, походы и что-то связанное с .",животные;походы
"Хочу поездку, чтобы отдохнуть и посмотреть на музыка, может быть, ещё походы.",музыка;походы;шопинг
"Хочу отдых, где можно совместить активность, еда и хорошее настроение.",активность;еда
Где можно насладиться музей и заодно заняться музыка?,музей;музыка;походы
"Планирую тур с пляж, вкусной спорт и атмосферой .",пляж;спорт
"Тур по Европе, главное — искусство, но и религия не помешает.",искусство;религия
"Хочу отдых, где можно совместить животные, походы и хорошее настроение.",животные;походы;релакс
"Просто хочу поездку с винный туризм, а остальное — как получится.",винный туризм;еда;пляж
Где можно насладиться дегустации и заодно заняться ?,дегустации
Планирую отпуск с уклоном в искусство и обязательно с природа.,искусство;природа
"Мне нужно всё сразу: и еда, и пляж, и .",еда;пляж
Что порекомендуете для любителя животные и парк?,животные;парк
Планирую отпуск с уклоном в искусство и обязательно с .,искусство
"Хочу поездку, чтобы отдохнуть и посмотреть на парк, может быть, ещё пляж.",парк;пляж
"Маршрут, включающий животные, история, ночная жизнь — реально?",животные;история;ночная жизнь
"Хочу отдых, где можно совместить дегустации, парк и хорошее настроение.",дегустации;парк;пляж
"Хочу поездку, чтобы отдохнуть и посмотреть на активность, может быть, ещё дегустации.",активность;дегустации;спорт
"Ищу необычный маршрут: хочется и активность, и немного музей.",активность;музей;релакс
Где в Европе можно насладиться природа и посетить релакс?,природа;релакс
