"Хочу в путешествии увидеть искусство, попробовать культура, а может и .",искусство;культура
"Планирую тур с искусство, вкусной ночная жизнь и атмосферой .",искусство;ночная жизнь
"Тур по Европе, главное — винный туризм, но и релакс не помешает.",винный туризм;релакс
"Планирую тур с история, вкусной ночная жизнь и атмосферой парк.",история;ночная жизнь;парк
Где в Европе можно насладиться еда и посетить искусство?,еда;искусство
"Подскажите город с еда, музыка, и чтобы вкусно поесть.",еда;музыка;шопинг
Планирую отпуск с уклоном в дегустации и обязательно с парк.,дегустации;парк;природа
"Хочу в путешествии увидеть релакс, попробовать , а может и .",релакс
Ищу место для фото с культура и прогулками в пляж.,культура;пляж
"Интересуют животные, культура, ну и конечно .",животные;культура
"Куда поехать летом, чтобы были ночная жизнь, религия и даже немного ?",ночная жизнь;религия
"Посоветуйте место, где есть парк, а вечером — .",парк
"Планирую тур с ночная жизнь, вкусной походы и атмосферой .",ночная жизнь;походы
"Маршрут, включающий ночная жизнь, парк, спорт — реально?",ночная жизнь;парк;спорт
Где в Европе можно насладиться искусство и посетить ?,искусство
"Подскажите город с дегустации, искусство, и чтобы вкусно поесть.",дегустации;искусство
Ищу место для фото с музыка и прогулками в релакс.,музыка;релакс;фотография
Что порекомендуете для любителя культура и музей?,культура;музей;спорт
"Мне нужно всё сразу: и музыка, и природа, и .",музыка;природа
Планирую отпуск с уклоном в музей и обязательно с природа.,музей;природа
Ищу место для фото с музыка и прогулками в .,музыка
"Хочу в путешествии увидеть дегустации, попробовать музей, а может и .",дегустации;музей
Ищу место для фото с природа и прогулками в фотография.,природа;фотография
"Тур по Европе, главное — дегустации, но и музей не помешает.",дегустации;музей;парк
"Ищу необычный маршрут: хочется и музей, и немного .",музей
"Маршрут, включающий история, парк,  — реально?",история;парк
"Мне нужно всё сразу: и фотография, и , и .",фотография
"Маршрут, включающий парк, походы, спорт — реально?",парк;походы;спорт
Что порекомендуете для любителя активность и пляж?,активность;пляж;природа
"Подскажите город с дегустации, история, и чтобы вкусно поесть.",дегустации;история;походы
Где можно насладиться еда и заодно заняться музей?,еда;музей
Ищу место для фото с еда и прогулками в искусство.,еда;искусство;музыка
"Тур по Европе, главное — релакс, но и спорт не помешает.",релакс;спорт
Планирую отпуск с уклоном в походы и обязательно с релакс.,походы;релакс
"Просто хочу поездку с винный туризм, а остальное — как получится.",винный туризм;пляж;походы
"Подскажите город с парк, походы, и чтобы вкусно поесть.",парк;походы
Планирую отпуск с уклоном в животные и обязательно с ночная жизнь.,животные;ночная жизнь;релакс
"Мне нужно всё сразу: и культура, и пляж, и природа.",культура;пляж;природа
"Тур по Европе, главное — природа, но и спорт не помешает.",природа;спорт;фотография
"Мне нужно всё сразу: и дегустации, и , и .",дегустации
Ищу место для фото с история и прогулками в музыка.,история;музыка
Ищу место для фото с музыка и прогулками в шопинг.,музыка;шопинг
Что порекомендуете для любителя спорт и ?,спорт
"Мне нужно всё сразу: и парк, и , и .",парк
"Просто хочу поездку с архитектура, а остальное — как получится.",архитектура;животные;релакс
"Просто хочу поездку с пляж, а остальное — как получится.",пляж;религия;шопинг
"Ищу необычный маршрут: хочется и музыка, и немного .",музыка
Где можно насладиться парк и заодно заняться ?,парк
"Меня интересуют животные, религия и что-то связанное с .",животные;религия
"Посоветуйте место, где есть искусство, а вечером — музей.",искусство;музей;природа
"Куда поехать летом, чтобы были активность, история и даже немного ?",активность;история
"Интересуют архитектура, природа, ну и конечно релакс.",архитектура;природа;релакс
Что порекомендуете для любителя фотография и ?,фотография
Где в Европе можно насладиться винный туризм и посетить животные?,винный туризм;животные
"Подскажите город с походы, релакс, и чтобы вкусно поесть.",походы;релакс
Где можно насладиться музей и заодно заняться религия?,музей;религия
"Хочу отдых, где можно совместить музыка, религия и хорошее настроение.",музыка;религия
Ищу место для фото с активность и прогулками в архитектура.,активность;архитектура;культура
"Интересуют архитектура, культура, ну и конечно .",архитектура;культура
"Куда поехать летом, чтобы были искусство, природа и даже немного религия?",искусство;природа;религия
"Просто хочу поездку с активность, а остальное — как получится.",активность;история
"Интересуют активность, архитектура, ну и конечно пляж.",активность;архитектура;пляж
"Хочу поездку, чтобы отдохнуть и посмотреть на дегустации, может быть, ещё природа.",дегустации;природа
"Куда поехать летом, чтобы были культура, музыка и даже немного ?",культура;музыка
"Просто хочу поездку с походы, а остальное — как получится.",походы;шопинг
Планирую отпуск с уклоном в спорт и обязательно с .,спорт
Что порекомендуете для любителя винный туризм и природа?,винный туризм;природа;религия
"Куда поехать летом, чтобы были культура, шопинг и даже немного ?",культура;шопинг
"Куда поехать летом, чтобы были пляж, походы и даже немного шопинг?",пляж;походы;шопинг
"Подскажите город с активность, , и чтобы вкусно поесть.",активность
"Подскажите город с искусство, история, и чтобы вкусно поесть.",искусство;история
"Хочу отдых, где можно совместить пляж, природа и хорошее настроение.",пляж;природа
"Интересуют культура, , ну и конечно .",культура
"Ищу необычный маршрут: хочется и активность, и немного музей.",активность;музей
Где можно насладиться музыка и заодно заняться походы?,музыка;походы
Что порекомендуете для любителя архитектура и религия?,архитектура;религия
"Куда поехать летом, чтобы были искусство, пляж и даже немного шопинг?",искусство;пляж;шопинг
"Мне нужно всё сразу: и музей, и спорт, и .",музей;спорт
Что порекомендуете для любителя парк и спорт?,парк;спорт;фотография
"Меня интересуют дегустации, спорт и что-то связанное с .",дегустации;спорт
"Планирую тур с животные, вкусной  и атмосферой .",животные
"Посоветуйте место, где есть природа, а вечером — релакс.",природа;релакс
Что порекомендуете для любителя ночная жизнь и спорт?,ночная жизнь;спорт;фотография
Планирую отпуск с уклоном в походы и обязательно с религия.,походы;религия
"Интересуют культура, музыка, ну и конечно спорт.",культура;музыка;спорт
"Планирую тур с дегустации, вкусной  и атмосферой .",дегустации
Где в Европе можно насладиться релакс и посетить ?,релакс
"Хочу поездку, чтобы отдохнуть и посмотреть на животные, может быть, ещё религия.",животные;религия
"Хочу поездку, чтобы отдохнуть и посмотреть на искусство, может быть, ещё культура.",искусство;культура
"Подскажите город с история, парк, и чтобы вкусно поесть.",история;парк
"Меня интересуют винный туризм, ночная жизнь и что-то связанное с .",винный туризм;ночная жизнь
"Маршрут, включающий еда, культура,  — реально?",еда;культура
"Маршрут, включающий музыка, пляж, релакс — реально?",музыка;пляж;релакс
Где в Европе можно насладиться еда и посетить искусство?,еда;искусство;шопинг
Что порекомендуете для любителя парк и пляж?,парк;пляж
"Куда поехать летом, чтобы были активность, история и даже немного культура?",активность;история;культура
"Хочу поездку, чтобы отдохнуть и посмотреть на музей, может быть, ещё природа.",музей;природа
"Куда поехать летом, чтобы были винный туризм, искусство и даже немного ?",винный туризм;искусство
"Хочу поездку, чтобы отдохнуть и посмотреть на еда, может быть, ещё фотография.",еда;фотография
"Хочу поездку, чтобы отдохнуть и посмотреть на животные, может быть, ещё музей.",животные;музей;религия
"Планирую тур с животные, вкусной музей и атмосферой спорт.",животные;музей;спорт
"Интересуют активность, пляж, ну и конечно релакс.",активность;пляж;релакс
"Интересует маршрут с дегустации и музей, но без спешки.",дегустации;музей;парк
Что порекомендуете для любителя культура и шопинг?,культура;шопинг
"Хочу отдых, где можно совместить животные, история и хорошее настроение.",животные;история
Планирую отпуск с уклоном в фотография и обязательно с .,фотография
"Тур по Европе, главное — дегустации, но и шопинг не помешает.",дегустации;шопинг
Что порекомендуете для любителя история и спорт?,история;спорт
"Мне нужно всё сразу: и активность, и фотография, и .",активность;фотография
"Хочу в путешествии увидеть история, попробовать пляж, а может и .",история;пляж
Где в Европе можно насладиться музей и посетить фотография?,музей;фотография
"Хочу в путешествии увидеть история, попробовать ночная жизнь, а может и спорт.",история;ночная жизнь;спорт
"Маршрут, включающий активность, дегустации,  — реально?",активность;дегустации
"Ищу необычный маршрут: хочется и архитектура, и немного .",архитектура
"Тур по Европе, главное — релакс, но и фотография не помешает.",релакс;фотография
"Куда поехать летом, чтобы были музей, релакс и даже немного спорт?",музей;релакс;спорт
"Тур по Европе, главное — архитектура, но и фотография не помешает.",архитектура;фотография
"Просто хочу поездку с парк, а остальное — как получится.",парк;фотография
"Посоветуйте место, где есть дегустации, а вечером — фотография.",дегустации;фотография
"Интересуют музей, религия, ну и конечно .",музей;религия
"Хочу отдых, где можно совместить история, музей и хорошее настроение.",история;музей
Что порекомендуете для любителя релакс и шопинг?,релакс;шопинг
Что порекомендуете для любителя история и ?,история
"Хочу отдых, где можно совместить винный туризм,  и хорошее настроение.",винный туризм
"Хочу в путешествии увидеть культура, попробовать , а может и .",культура
"Хочу поездку, чтобы отдохнуть и посмотреть на история, может быть, ещё фотография.",история;фотография
Что порекомендуете для любителя архитектура и парк?,архитектура;парк
"Хочу в путешествии увидеть винный туризм, попробовать шопинг, а может и .",винный туризм;шопинг
"Хочу поездку, чтобы отдохнуть и посмотреть на искусство, может быть, ещё .",искусство
"Просто хочу поездку с музей, а остальное — как получится.",музей;музыка;шопинг
"Интересует маршрут с еда и спорт, но без спешки.",еда;спорт
"Маршрут, включающий архитектура, дегустации, еда — реально?",архитектура;дегустации;еда
"Хочу поездку, чтобы отдохнуть и посмотреть на история, может быть, ещё шопинг.",история;шопинг
"Мне нужно всё сразу: и музыка, и парк, и религия.",музыка;парк;религия
"Интересуют животные, спорт, ну и конечно .",животные;спорт
Ищу место для фото с фотография и прогулками в шопинг.,фотография;шопинг
"Интересуют природа, , ну и конечно .",природа
Где в Европе можно насладиться архитектура и посетить дегустации?,архитектура;дегустации
Где можно насладиться походы и заодно заняться ?,походы
"Посоветуйте место, где есть музей, а вечером — .",музей
Где можно насладиться дегустации и заодно заняться еда?,дегустации;еда;релакс
Ищу место для фото с спорт и прогулками в .,спорт
"Куда поехать летом, чтобы были религия,  и даже немного ?",религия
"Хочу поездку, чтобы отдохнуть и посмотреть на парк, может быть, ещё спорт.",парк;спорт
"Мне нужно всё сразу: и походы, и , и .",походы
Где можно насладиться музей и заодно заняться походы?,музей;походы
"Интересует маршрут с музей и религия, но без спешки.",музей;религия;шопинг
"Просто хочу поездку с история, а остальное — как получится.",история;парк
"Интересуют архитектура, шопинг, ну и конечно .",архитектура;шопинг
"Хочу в путешествии увидеть культура, попробовать парк, а может и .",культура;парк
Где в Европе можно насладиться музей и посетить музыка?,музей;музыка;природа
Где можно насладиться фотография и заодно заняться ?,фотография
"Интересует маршрут с ночная жизнь и , но без спешки.",ночная жизнь
"Посоветуйте место, где есть ночная жизнь, а вечером — .",ночная жизнь
"Просто хочу поездку с природа, а остальное — как получится.",природа;религия
"Тур по Европе, главное — еда, но и история не помешает.",еда;история;фотография
"Хочу в путешествии увидеть еда, попробовать искусство, а может и .",еда;искусство
"Хочу отдых, где можно совместить искусство, спорт и хорошее настроение.",искусство;спорт
"Хочу отдых, где можно совместить активность, винный туризм и хорошее настроение.",активность;винный туризм;парк
"Хочу поездку, чтобы отдохнуть и посмотреть на еда, может быть, ещё природа.",еда;природа
Что порекомендуете для любителя активность и еда?,активность;еда
"Тур по Европе, главное — архитектура, но и  не помешает.",архитектура
"Маршрут, включающий музыка, ,  — реально?",музыка
"Хочу поездку, чтобы отдохнуть и посмотреть на культура, может быть, ещё .",культура
"Меня интересуют активность, животные и что-то связанное с .",активность;животные
"Маршрут, включающий животные, искусство, природа — реально?",животные;искусство;природа
Планирую отпуск с уклоном в ночная жизнь и обязательно с шопинг.,ночная жизнь;шопинг
"Интересуют музыка, природа, ну и конечно .",музыка;природа
"Хочу поездку, чтобы отдохнуть и посмотреть на культура, может быть, ещё парк.",культура;парк;спорт
Что порекомендуете для любителя история и релакс?,история;релакс
"Меня интересуют искусство, природа и что-то связанное с фотография.",искусство;природа;фотография
"Интересует маршрут с дегустации и , но без спешки.",дегустации
Где можно насладиться дегустации и заодно заняться искусство?,дегустации;искусство
"Ищу необычный маршрут: хочется и архитектура, и немного культура.",архитектура;культура
"Хочу поездку, чтобы отдохнуть и посмотреть на активность, может быть, ещё винный туризм.",активность;винный туризм;шопинг
"Интересует маршрут с дегустации и шопинг, но без спешки.",дегустации;шопинг
Где можно насладиться релакс и заодно заняться ?,релакс
"Хочу отдых, где можно совместить ночная жизнь,  и хорошее настроение.",ночная жизнь
"Маршрут, включающий активность, винный туризм,  — реально?",активность;винный туризм
Ищу место для фото с дегустации и прогулками в животные.,дегустации;животные;музыка
"Интересуют винный туризм, искусство, ну и конечно .",винный туризм;искусство
Планирую отпуск с уклоном в животные и обязательно с фотография.,животные;фотография
"Хочу в путешествии увидеть дегустации, попробовать животные, а может и искусство.",дегустации;животные;искусство
"Маршрут, включающий животные, природа,  — реально?",животные;природа
"Тур по Европе, главное — искусство, но и спорт не помешает.",искусство;спорт
"Интересуют дегустации, животные, ну и конечно религия.",дегустации;животные;религия
